{
  "videoId": "dQw4w9WgXcQ",
  "language": "en",
  "trackKind": "standard",
  "segments": [
    {
      "start": 0,
      "duration": 5.2,
      "text": "Welcome aboard the Bernina Express."
    },
    {
      "start": 5.2,
      "duration": 8.1,
      "text": "We are departing from Chur, heading south through the Swiss Alps."
    },
    {
      "start": 13.3,
      "duration": 6.5,
      "text": "The Bernina line is one of the most spectacular railway routes in the world."
    },
    {
      "start": 19.8,
      "duration": 7.0,
      "text": "Reaching a summit of 2253 metres, it is the highest railway crossing in the Alps."
    }
  ],
  "fullText": "Welcome aboard the Bernina Express. We are departing from Chur, heading south through the Swiss Alps. The Bernina line is one of the most spectacular railway routes in the world. Reaching a summit of 2253 metres, it is the highest railway crossing in the Alps.",
  "source": "youtube",
  "updatedAt": "2026-03-20T12:00:00Z"
}
